{
  "schema_version": "1.0",
  "run_id": "smoke-evolution",
  "agent": "Auto Evolution Orchestrator",
  "artifact_type": "evolution-run-report",
  "created_at": "2026-05-13T14:00:00Z",
  "depends_on": [
    "outputs/_smoke-evolution/30-evolution-code-analysis.json",
    "outputs/_smoke-evolution/31-evolution-refactor.json",
    "outputs/_smoke-evolution/32-evolution-bugfix.json",
    "outputs/_smoke-evolution/33-evolution-test-generation.json",
    "outputs/_smoke-evolution/34-evolution-security-patch.json",
    "outputs/_smoke-evolution/35-evolution-performance.json"
  ],
  "assumptions": [],
  "open_questions": [],
  "payload": {
    "run_summary": "Smoke: nenhum PR real; relatório para validação de schema.",
    "pull_requests": [],
    "verification_checklist": [
      "Executar suíte de testes do repositório alvo após evolução real."
    ],
    "rollback_notes": [
      "Reverter branch de trabalho ou fechar PR sem merge se CI falhar."
    ],
    "follow_up": [
      "Opcional: rodar Audit Factory no commit alterado para fechar o ciclo."
    ],
    "factory_integration": {
      "suggested_next_actions": [
        "Após merges, atualizar artefatos do System Builder impactados (PRD, arquitetura, segurança)."
      ]
    }
  }
}
