{
  "schema_version": "1.0",
  "run_id": "smoke-evolution",
  "agent": "Auto Evolution Orchestrator",
  "artifact_type": "evolution-scope",
  "created_at": "2026-05-13T14:00:00Z",
  "depends_on": [],
  "assumptions": [],
  "open_questions": [],
  "payload": {
    "target_summary": "Smoke: escopo mínimo de evolução automática.",
    "repository": {
      "local_path": ".",
      "default_branch": "main",
      "work_branch_prefix": "fabrica-evol/"
    },
    "goals": ["Validar schemas de artefatos"],
    "constraints": ["Sem push em default_branch"],
    "safety_policy": {
      "require_review_for_risk": ["high", "medium"],
      "required_checks": [
        "npm test",
        "npm run lint",
        "npm run typecheck"
      ]
    },
    "automation_mode": "suggest-only"
  }
}
