{
  "schema_version": "1.0",
  "run_id": "smoke-evolution",
  "agent": "Security Patch Agent",
  "artifact_type": "evolution-security-patch",
  "created_at": "2026-05-13T14:00:00Z",
  "depends_on": ["outputs/_smoke-evolution/00-evolution-scope.json"],
  "assumptions": [],
  "open_questions": [],
  "payload": {
    "summary": "Smoke: sem itens de trabalho reais.",
    "items": []
  }
}
