{
  "schema_version": "1.0",
  "run_id": "smoke",
  "agent": "test",
  "artifact_type": "project-inventory",
  "created_at": "2026-05-13T12:00:00Z",
  "depends_on": [],
  "assumptions": [],
  "open_questions": [],
  "payload": {
    "repo_summary": "smoke",
    "tech_stack": { "lang": ["ts"] },
    "reuse_candidates": [
      {
        "name": "x",
        "path_glob": "*",
        "reuse_strategy": "none"
      }
    ],
    "gaps": [],
    "risks": [],
    "recommended_next_steps": []
  }
}
